Dodotronic Ultramic 250
=========================== USB Port1 ===========================
Connection Status		 	:		0x01 (Device is connected)
Port Chain		 			:		1-1
========================== Summary =========================
Vendor ID		 			:		0x0869 (Visual Interaction)
Product ID		 			:		0x0306
USB version		 			:		1.10
Port maximum Speed		 	:		High-Speed
Device maximum Speed		:		Full-Speed
Device Connection Speed		:		Full-Speed
Self Powered		 		:		yes
Demanded Current		 	:		100 mA
Used Endpoints		 		:		1
======================== USB Device ========================
+++++++++++++++++ Device Information ++++++++++++++++++
Device Description		 	:		USB-Verbundgerät
Device Path 				:		\\?\USB#VID_0869&PID_0306#5&521a615&0&1#{a5dcbf10-6530-11d2-901f- 00c04fb951ed} (GUID_DEVINTERFACE_USB_DEVICE)
Kernel Name		 			:		\Device\USBPDO-15
Device ID		 			:		USB\VID_0869&PID_0306\5&521A615&0&1
Hardware IDs				:		USB\VID_0869&PID_0306&REV_0003 USB\VID_0869&PID_0306
Driver KeyName		 		:		{36fc9e60-c465-11cf-8056-444553540000}\0049 (GUID_DEVCLASS_USB)
Driver		 				:		\SystemRoot\System32\drivers\usbccgp.sys (Version: 10.0.19041.488 Date: 2020-09-11)
Driver Inf		 			:		C:\Windows\inf\usb.inf
Legacy BusType		 		:		PNPBus
Class		 				:		USB
Class GUID		 			:		{36fc9e60-c465-11cf-8056-444553540000} (GUID_DEVCLASS_USB)
Service		 				:		usbccgp
Enumerator		 			:		USB
Location Info			 	:		Port_#0001.Hub_#0001
Location IDs		 		:		PCIROOT(0)#PCI(1400)#USBROOT(0)#USB(1), ACPI(_SB_)#ACPI(PCI0)#ACPI(XHC_)#ACPI(RHUB)#ACPI(HS01)
Container ID		 		:		{b2bbf4b0-92f3-11ec-952f-000ec6c8fad4}
Manufacturer Info		 	:		(Standard-USB-Hostcontroller)
Capabilities		 		:		0x84 (Removable, SurpriseRemovalOK)
Status		 				:		0x0180600A (DN_DRIVER_LOADED, DN_STARTED, DN_DISABLEABLE, DN_REMOVABLE, DN_NT_ENUMERATOR, DN_NT_DRIVER)
Problem Code		 		:		0
Address		 				:		1
HcDisableSelectiveSuspend	: 		0
EnableSelectiveSuspend		:		0
SelectiveSuspendEnabled		:		0
EnhancedPowerMgmtEnabled	:		0
IdleInWorkingState		 	:		0
WakeFromSleepState		 	:		0
Power State		 			:		D0 (supported: D0, D3, wake from D0)
Child Device 1		 		:		UltraMic 250K 16 bit r4 (USB-Audiogerät)Device Path 1 : \\?\USB#VID_0869&PID_0306&MI_00#6&b11ff40&1&0000#{65e8773d-8f56-11d0-a3b9 00a0c9223196}\global (AM_KSCATEGORY_CAPTURE)
Device Path 2 				:		\\?\USB#VID_0869&PID_0306&MI_00#6&b11ff40&1&0000#{6994ad04-93ef-11d0-a3cc-
00a0c9223196}\global (AM_KSCATEGORY_AUDIO)
Kernel Name		 			:		\Device\000001a3
Device ID		 			:		USB\VID_0869&PID_0306&MI_00\6&B11FF40&1&0000
Class		 				:		MEDIA
Driver KeyName		 		:		{4d36e96c-e325-11ce-bfc1-08002be10318}\0010 (GUID_DEVCLASS_MEDIA)
Service		 				:		usbaudio
Child Device 1		 		:		Microphone (UltraMic 250K 16 bit r4) (Audioendpunkt)
Device Path		 			:		\\?\SWD#MMDEVAPI#{0.0.1.00000000}.{2053fe27-2355-4c6c-afff-7056a2479a28}#{2eef81be-33fa-4800-9670-1cd474972c3f} (DEVINTERFACE_AUDIO_CAPTURE)
Kernel Name		 			:		\Device\000001a5
Device ID		 			:		SWD\MMDEVAPI\{0.0.1.00000000}.{2053FE27-2355-4C6C-AFFF-7056A2479A28}
Class		 				:		AudioEndpoint
Driver KeyName		 		:		{c166523c-fe0c-4a94-a586-f1a80cfbbf3e}\0029 (AUDIOENDPOINT_CLASS_UUID)
---------------- Connection Information ---------------
Connection Index		 	:		0x01 (Port 1)
Connection Status		 	:		0x01 (DeviceConnected)
Current Config Value		:		0x01 (Configuration 1)
Device Address		 		:		0x1E (30)
Is Hub		 				:		0x00 (no)
Device Bus Speed		 	:		0x01 (Full-Speed)
Number Of Open Pipes		:		0x00 (0 pipes to data endpoints)
Data (HexDump)		 		:		01 00 00 00 12 01 10 01 00 00 00 08 69 08 06 03		............i...
									03 00 01 02 03 01 01 01 00 1E 00 00 00 00 00 01		................
									00 00 00											...
--------------- Connection Information V2 -------------
Connection Index		 	:		0x01 (1)
Length		 				:		0x10 (16 bytes)
SupportedUsbProtocols		:		0x03
Usb110		 				:		1 (yes, port supports USB 1.1)
Usb200		 				:		1 (yes, port supports USB 2.0)
Usb300		 				:		0 (no, port not supports USB 3.0)
ReservedMBZ		 			:		0x00
Flags		 				:		0x00
DevIsOpAtSsOrHigher		 	:		0 (Device is not operating at SuperSpeed or	higher)
DevIsSsCapOrHigher		 	:		0 (Device is not SuperSpeed capable or higher)
DevIsOpAtSsPlusOrHigher		:		0 (Device is not operating at SuperSpeedPlus or	higher)
DevIsSsPlusCapOrHigher		:		0 (Device is not SuperSpeedPlus capable or higher)
ReservedMBZ		 			:		0x00
Data (HexDump)		 		:		01 00 00 00 10 00 00 00 03 00 00 00 00 00 00 00			................
---------------------- Device Descriptor ----------------------
bLength		 				:		0x12 (18 bytes)bDescriptorType		 :		0x01 (Device Descriptor)
bcdUSB		 				:		0x110 (USB Version 1.10)
bDeviceClass		 		:		0x00 (defined by the interface descriptors)
bDeviceSubClass		 		:		0x00
bDeviceProtocol		 		:		0x00
bMaxPacketSize0		 		:		0x08 (8 bytes)
idVendor		 			:		0x0869 (Visual Interaction)
idProduct		 			:		0x0306
bcdDevice		 			:		0x0003
iManufacturer		 		:		0x01 (String Descriptor 1)
Language 0x0409		 		:		"DODOTRONIC Technology ."
iProduct			 		:		0x02 (String Descriptor 2)
Language 0x0409		 		:		"UltraMic 250K 16 bit r4"
iSerialNumber		 		:		0x03 (String Descriptor 3)
*!*ERROR String descriptor not found
bNumConfigurations		 	:		0x01 (1 Configuration)
Data (HexDump)		 		:		12 01 10 01 00 00 00 08 69 08 06 03 03 00 01 02		........i.......
									03 01												..
------------------ Configuration Descriptor -------------------
bLength		 				:		0x09 (9 bytes)
bDescriptorType		 		:		0x02 (Configuration Descriptor)
wTotalLength		 		:		0x0064 (100 bytes)
bNumInterfaces		 		:		0x02 (2 Interfaces)
bConfigurationValue		 	:		0x01 (Configuration 1)
iConfiguration		 		:		0x00 (No String Descriptor)
bmAttributes		 		:		0xC0
D7: Reserved, set 1		 	:		0x01
D6: Self Powered		 	:		0x01 (yes)
D5: Remote Wakeup		 	:		0x00 (no)
D4..0: Reserved, set 0	 	:		0x00
MaxPower		 			:		0x32 (100 mA)
Data (HexDump)		 		:		09 02 64 00 02 01 00 C0 32 09 04 00 00 00 01 01		..d.....2.......
									00 00 09 24 01 00 01 1E 00 01 01 0C 24 02 01 01		...$........$...
									02 00 01 00 00 00 00 09 24 03 02 01 01 00 01 00		........$.......
									09 04 01 00 00 01 02 00 00 09 04 01 01 01 01 02		................
									00 00 07 24 01 02 01 01 00 0B 24 02 01 01 02 10		...$......$.....
									01 90 D0 03 09 05 81 01 00 02 01 00 00 07 25 01		..............%.
									00 00 00 00											....
---------------- Interface Descriptor -----------------
bLength			 			:		0x09 (9 bytes)
bDescriptorType		 		:		0x04 (Interface Descriptor)
bInterfaceNumber		 	:		0x00
bAlternateSetting		 	:		0x00
bNumEndpoints		 		:		0x00 (Default Control Pipe only)
bInterfaceClass		 		:		0x01 (Audio)
bInterfaceSubClass		 	:		0x01 (Audio Control)
bInterfaceProtocol		 	:		0x00
iInterface		 			:		0x00 (No String Descriptor)
Data (HexDump)		 		:		09 04 00 00 00 01 01 00 00
.........------ Audio Control Interface Header Descriptor ------
bLength		 				:		0x09 (9 bytes)
bDescriptorType		 		:		0x24 (Audio Interface Descriptor)
bDescriptorSubtype		 	:		0x01 (Header)
bcdADC		 				:		0x0100
wTotalLength		 		:		0x001E (30 bytes)
bInCollection		 		:		0x01
baInterfaceNr[1]		 	:		0x01
Data (HexDump)		 		:		09 24 01 00 01 1E 00 01 01
.$.......
------- Audio Control Input Terminal Descriptor -------
bLength		 				:		0x0C (12 bytes)
bDescriptorType		 		:		0x24 (Audio Interface Descriptor)
bDescriptorSubtype		 	:		0x02 (Input Terminal)
bTerminalID		 			:		0x01
wTerminalType		 		:		0x0201 (Microphone)
bAssocTerminal		 		:		0x00
bNrChannels		 			:		0x01 (1 channel)
wChannelConfig		 		:		0x0000 (-)
iChannelNames		 		:		0x00 (No String Descriptor)
iTerminal		 			:		0x00 (No String Descriptor)
Data (HexDump)		 		:		0C 24 02 01 01 02 00 01 00 00 00 00		.$..........
------- Audio Control Output Terminal Descriptor ------
bLength		 				:		0x09 (9 bytes)
bDescriptorType		 		:		0x24 (Audio Interface Descriptor)
bDescriptorSubtype		 	:		0x03 (Output Terminal)
bTerminalID		 			:		0x02
wTerminalType		 		:		0x0101 (USB streaming)
bAssocTerminal		 		:		0x00 (0)
bSourceID		 			:		0x01 (1)
iTerminal		 			:		0x00 (No String Descriptor)
Data (HexDump)		 		:		09 24 03 02 01 01 00 01 00		.$.......
---------------- Interface Descriptor -----------------
bLength		 				:		0x09 (9 bytes)
bDescriptorType		 		:		0x04 (Interface Descriptor)
bInterfaceNumber		 	:		0x01
bAlternateSetting		 	:		0x00
bNumEndpoints		 		:		0x00 (Default Control Pipe only)
bInterfaceClass		 		:		0x01 (Audio)
bInterfaceSubClass		 	:		0x02 (Audio Streaming)
bInterfaceProtocol		 	:		0x00
iInterface		 			:		0x00 (No String Descriptor)
Data (HexDump)		 		:		09 04 01 00 00 01 02 00 00		.........
---------------- Interface Descriptor -----------------
bLength		 				:		0x09 (9 bytes)
bDescriptorType		 		:		0x04 (Interface Descriptor)
bInterfaceNumber		 	:		0x01
bAlternateSetting		 	:		0x01
bNumEndpoints		 		:		0x01 (1 Endpoint)
bInterfaceClass		 		:		0x01 (Audio)
bInterfaceSubClass		 	:		0x02 (Audio Streaming)
bInterfaceProtocol		 	:		0x00
iInterface		 			:		0x00 (No String Descriptor)Data 
(HexDump)		 			:		09 04 01 01 01 01 02 00 00		.........
-------- Audio Streaming Interface Descriptor ---------
bLength		 				:		0x07 (7 bytes)
bDescriptorType		 		:		0x24 (Audio Interface Descriptor)
bDescriptorSubtype		 	:		0x01
bTerminalLink		 		:		0x02
bDelay		 				:		0x01
wFormatTag		 			:		0x0001 (PCM)
Data (HexDump)		 		:		07 24 01 02 01 01 00 		.$.....
------- Audio Streaming Format Type Descriptor --------
bLength		 				:		0x0B (11 bytes)
bDescriptorType		 		:		0x24 (Audio Interface Descriptor)
bDescriptorSubtype		 	:		0x02 (Format Type)
bFormatType		 			:		0x01 (FORMAT_TYPE_I)
bNrChannels		 			:		0x01 (1 channel)
bSubframeSize		 		:		0x02 (2 bytes per subframe)
bBitResolution		 		:		0x10 (16 bits per sample)
bSamFreqType		 		:		0x01 (supports 1 sample frequence)
tSamFreq[1]		 			:		0x3D090 (250000 Hz)
Data (HexDump)		 		:		0B 24 02 01 01 02 10 01 90 D0 03	.$.........
----------------- Endpoint Descriptor -----------------
bLength		 				:		0x09 (9 bytes)
bDescriptorType		 		:		0x05 (Endpoint Descriptor)
bEndpointAddress		 	:		0x81 (Direction=IN EndpointID=1)
bmAttributes		 		:		0x01 (TransferType=Isochronous SyncType=None EndpointType=Data)
wMaxPacketSize		 		:		0x0200 (512 bytes)
bInterval		 			:		0x01 (1 ms)
bRefresh		 			:		0x00
bSynchAddress		 		:		0x00
Data (HexDump)		 		:		09 05 81 01 00 02 01 00 00 		.........
----------- Audio Data Endpoint Descriptor ------------
bLength		 				:		0x07 (7 bytes)
bDescriptorType		 		:		0x25 (Audio Endpoint Descriptor)
bDescriptorSubtype		 	:		0x01 (General)
bmAttributes		 		:		0x00
D0		 					:		Sampling Freq : 0x00 (not supported)
D1		 					:		Pitch : 0x00 (not supported)
D6..2: Reserved		 		:		0x00
D7		 					:		MaxPacketsOnly : 0x00 (no)
bLockDelayUnits		 		:		0x00 (Undefined)
wLockDelay		 			:		0x0000
Data (HexDump)		 		:		07 25 01 00 00 00 00		.%.....
-------------------- String Descriptors -------------------
------ String Descriptor 0 ------
bLength		 				:		0x04 (4 bytes)
bDescriptorType		 		:		0x03 (String Descriptor)
Language ID[0]		 		:		0x0409 (English - United States)
Data (HexDump)		 		:		04 03 09 04			....
------ String Descriptor 1 ------bLength		 :		0x34 (52 bytes)
bDescriptorType		 		:		0x03 (String Descriptor)
Language 0x0409		 		:		"DODOTRONIC Technology ."
Data (HexDump)		 		:		34 03 44 00 4F 00 44 00 4F 00 54 00 52 00 4F 00		4.D.O.D.O.T.R.O.
									4E 00 49 00 43 00 20 00 54 00 65 00 63 00 68 00		N.I.C. .T.e.c.h.
									6E 00 6F 00 6C 00 6F 00 67 00 79 00 20 00 20 00		n.o.l.o.g.y. . .
									20 00 2E 00											...
------ String Descriptor 2 ------
bLength		 				:		0x30 (48 bytes)
bDescriptorType		 		:		0x03 (String Descriptor)
Language 0x0409		 		:		"UltraMic 250K 16 bit r4"
Data (HexDump)		 		:		30 03 55 00 6C 00 74 00 72 00 61 00 4D 00 69 00		0.U.l.t.r.a.M.i.
									63 00 20 00 32 00 35 00 30 00 4B 00 20 00 31 00		c. .2.5.0.K. .1.
									36 00 20 00 62 00 69 00 74 00 20 00 72 00 34 00		6. .b.i.t. .r.4.
